{
  "schemaVersion": "furniture-catalog-json/v1",
  "catalogId": "room2scan_default_furniture",
  "catalogVersion": "0.1.0",
  "updatedAt": "2026-05-06T13:00:00Z",
  "coordinateSystem": {
    "unit": "meter",
    "handedness": "left",
    "upAxis": "+Y",
    "forwardAxis": "+Z"
  },
  "assetsBaseUri": "Assets/Resources/Furniture",
  "items": [
    {
      "catalogId": "bed_queen_01",
      "displayName": "Queen Bed",
      "category": "bed",
      "asset": {
        "sourceType": "unity_resources",
        "format": "unity_prefab",
        "uri": "Furniture/BedQueen01"
      },
      "thumbnailUri": "thumbnails/bed_queen_01.png",
      "dimensions": {
        "size": {
          "x": 1.6,
          "y": 0.65,
          "z": 2.1
        },
        "pivot": "center_bottom"
      },
      "footprint": {
        "shape": "box",
        "center": {
          "x": 0.0,
          "z": 0.0
        },
        "size": {
          "x": 1.6,
          "z": 2.1
        }
      },
      "collisionProxy": {
        "shape": "box",
        "center": {
          "x": 0.0,
          "y": 0.325,
          "z": 0.0
        },
        "size": {
          "x": 1.6,
          "y": 0.65,
          "z": 2.1
        }
      },
      "placementRules": {
        "allowedSurfaces": [
          "floor"
        ],
        "rotationStepDeg": 90.0,
        "clearanceMeters": 0.03,
        "canRotate": true,
        "canDelete": true,
        "snapToWall": false
      },
      "defaultTransform": {
        "rotationYDeg": 0.0,
        "scale": {
          "x": 1.0,
          "y": 1.0,
          "z": 1.0
        },
        "spawnOffset": {
          "x": 0.0,
          "y": 0.0,
          "z": 0.0
        }
      },
      "tags": [
        "bedroom",
        "large"
      ],
      "metadata": {
        "source": "placeholder"
      }
    },
    {
      "catalogId": "desk_basic_01",
      "displayName": "Basic Desk",
      "category": "desk",
      "asset": {
        "sourceType": "unity_resources",
        "format": "unity_prefab",
        "uri": "Furniture/DeskBasic01"
      },
      "thumbnailUri": "thumbnails/desk_basic_01.png",
      "dimensions": {
        "size": {
          "x": 1.2,
          "y": 0.75,
          "z": 0.6
        },
        "pivot": "center_bottom"
      },
      "footprint": {
        "shape": "box",
        "center": {
          "x": 0.0,
          "z": 0.0
        },
        "size": {
          "x": 1.2,
          "z": 0.6
        }
      },
      "collisionProxy": {
        "shape": "box",
        "center": {
          "x": 0.0,
          "y": 0.375,
          "z": 0.0
        },
        "size": {
          "x": 1.2,
          "y": 0.75,
          "z": 0.6
        }
      },
      "placementRules": {
        "allowedSurfaces": [
          "floor"
        ],
        "rotationStepDeg": 15.0,
        "clearanceMeters": 0.03,
        "canRotate": true,
        "canDelete": true,
        "snapToWall": true
      },
      "defaultTransform": {
        "rotationYDeg": 0.0,
        "scale": {
          "x": 1.0,
          "y": 1.0,
          "z": 1.0
        },
        "spawnOffset": {
          "x": 0.0,
          "y": 0.0,
          "z": 0.0
        }
      },
      "tags": [
        "office"
      ],
      "metadata": {
        "source": "placeholder"
      }
    },
    {
      "catalogId": "chair_dining_01",
      "displayName": "Dining Chair",
      "category": "chair",
      "asset": {
        "sourceType": "local_glb",
        "format": "glb",
        "uri": "Furniture/GLB/chair_dining_01.glb",
        "checksum": {
          "algorithm": "sha256",
          "value": "cba03e0b23afba6cf0e7f56c18ba1a0d9882da7e3f79f6f353c45c80e9080f52"
        }
      },
      "thumbnailUri": "thumbnails/chair_dining_01.png",
      "dimensions": {
        "size": {
          "x": 0.48,
          "y": 0.9,
          "z": 0.52
        },
        "pivot": "center_bottom"
      },
      "footprint": {
        "shape": "box",
        "center": {
          "x": 0.0,
          "z": 0.0
        },
        "size": {
          "x": 0.48,
          "z": 0.52
        }
      },
      "collisionProxy": {
        "shape": "box",
        "center": {
          "x": 0.0,
          "y": 0.45,
          "z": 0.0
        },
        "size": {
          "x": 0.48,
          "y": 0.9,
          "z": 0.52
        }
      },
      "placementRules": {
        "allowedSurfaces": [
          "floor"
        ],
        "rotationStepDeg": 15.0,
        "clearanceMeters": 0.02,
        "canRotate": true,
        "canDelete": true,
        "snapToWall": false
      },
      "defaultTransform": {
        "rotationYDeg": 0.0,
        "scale": {
          "x": 1.0,
          "y": 1.0,
          "z": 1.0
        },
        "spawnOffset": {
          "x": 0.0,
          "y": 0.0,
          "z": 0.0
        }
      },
      "tags": [
        "dining",
        "small"
      ],
      "metadata": {
        "source": "sample_glb"
      }
    }
  ],
  "extensions": {}
}
